재료_아이디,재료_이름,제철,보관온도,100g당 열량,잘맞는 음식,안맞는 음식,효능,구입요령,손질법,조리법,보관법,설명
157,사과,10~12월,1~5℃,49Kcal,고구마,,"변비, 피로회복, 동맥경화, 항산화 효과, 피부미용","껍질에 상처가 없고 탄력이 있으며, 꼭지가 오래되지 않은 것이 신선하다.",깨끗한 물에 씻어 물기를 닦아낸다.,"생식하거나 잼, 주스, 샐러드로 활용한다.",비닐팩에 넣어 냉장 보관하거나 서늘한 곳에 보관한다.,
161,아보카도,연중,10~15℃,187Kcal,레몬,,"피부건강, 동맥경화, 변비, 면역력 강화, 항암효과","껍질이 녹색에서 거무스름하게 변하고, 눌러보았을 때 탄력 있는 것이 좋다.","씨를 따라 한바퀴 돌려 칼집을 내고 좌우를 각각 반대 방향으로 비튼 후, 씨에 칼날의 모서리를 찔러 비틀어 뺀다.","생식하거나 샐러드, 샌드위치에 활용한다.","익지 않은 것은 실온에 보관하고, 다 익은 것은 비닐에 넣어 냉장보관한다.",
166,유자,11~12월,0~5℃,42Kcal,쇠고기,,"피로회복, 감기예방, 피부미용",껍질이 단단하고 울퉁불퉁하며 향과 색이 짙은 것이 좋다.,흐르는 물에 깨끗이 씻는다.,설탕에 재워 유자청을 만들어 차로 음용한다.,껍질째로 신문지에 싸서 냉장 보관한다. 유자는 비타민C가 풍부해 금속용기에 넣으면 산화가 촉진되므로 유리 용기에 보관하는 것이 좋다.,
169,키위,8~10월,1~5℃,64Kcal,육류,,"피부미용, 피로회복, 감기예방, 변비, 소화","바로 먹을 시에는 가볍게 눌러보아 탄력 있는 것을 고르고, 보관해두고 먹을 경우 단단한 것을 구매해 후숙시켜 먹는다.",깨끗이 씻어 잔털을 제거하고 세로로 결을 따라 껍질을 벗겨낸다.,"생식하거나 잼, 주스, 샐러드에 활용한다. 고기를 잴때 넣으면 연육 효과가 있다.","덜 익은 키위는 상온에 두고 말랑말랑해지면 먹고, 다 익은 후에는 다른 과일과 분리해서 냉장 보관한다.",
171,파인애플,3~9월,7~10℃,55Kcal,돼지고기,,"소화, 피로회복, 피부미용, 식욕증진, 골다공증","윗부분의 껍질이 녹색이고 단단하며, 아랫부분의 껍질은 노란색이고 볼록한것이 좋다.",꼭지를 잘라 겉껍질을 벗겨내고 딱딱한 심을 제거한다.,"생식하거나 주스, 볶음밥에 넣어 활용한다. 먹고난 후 혀가 아프다면 구워 먹으면 된다.","단맛이 균등하지 않으므로 전체에 단맛이 돌도록 잎사귀가 밑으로 오도록 거꾸로 세워서 익힌다. 통째로 보관할때는 그대로, 자른 것은 비닐팩에 넣어 냉장 보관한다.",
173,포도,8~10월,1~5℃,46Kcal,사과,설탕,"피로회복, 시력개선, 간, 고혈압 예방",과분이 균일하게 묻어있고 알이 꽉 찬 것이 좋다. 태양광을 많이 받은 위쪽이 달고 아래로 갈수록 신맛이 강하므로 아래쪽을 먹어보고 고른다.,"농약을 제거하기 위해 식초를 몇방울 떨어뜨린 물에 10분정도 담가 두고, 흐르는 물에 깨끗하게 씻는다.","생식하거나 주스, 잼, 젤리, 건포도로 활용한다.",너무 차면 단맛이 떨어지므로 2~3일 정도 냉장보관 한다. 포도 봉지에 쌓인 상태로 냉장보관한다.,
174,올리브,연중,1~5℃,85Kcal,토마토,,"노화방지, 콜레스테롤, 항암 효과, 혈액순환, 심장병 예방",우리나라에서는 과육을 구입하지 않고 병조림으로 구매한다.,흐르는 물에 깨끗이 씻는다.,생과 그대로 먹으면 쓴맛이 있어 먹을 수 없다. 소금에 절여 병조림으로 만들어 먹거나 올리브유를 통해 섭취한다.,"병조림을 개봉한 후에는, 공기와의 접촉을 차단하기 위해 잘 밀봉해 냉장보관한다.",
183,땅콩,"9월, 10월, 11월",-20℃~0℃,568Kcal,돼지고기,,"피로 해소, 혈관질환 예방, 당뇨 예방, 두뇌 발달",껍질이 있고 곰팡이 냄새가 나지 않는 것,미지근한 물에 담가 껍질을 불린 후 껍질을 벗긴다.,"볶아서 먹거나 죽, 잼 등을 만들어 먹는다.",밀봉하여 서늘한 곳에 보관,
185,도토리,"9월, 10월, 11월, 12월",10~15℃,230Kcal,,감,"중금속 제거, 성인병 예방, 장염 완화, 피로 해소","겉이 단단하고 껍질이 매끄러운 것, 물에 넣었을 때 떠오르지 않는 것.",물에 담가서 떫은 맛을 없앤다.,"묵이나 국수, 수제비로 만들어 먹는다.",껍질을 벗긴 뒤 말려서 냉장보관,
186,밤,"9월, 10월, 11월, 12월",-1℃~0℃,167Kcal,닭고기,,"숙취 해소, 생리통 완화, 시력 보호, 면역력 향상",무겁고 껍질에 윤이 나는 것,물에 씻은 후 껍질을 벗긴다.,"생으로 먹거나 굽거나 쪄서 먹거나 다식, 베이킹 등에 이용한다.",속껍질까지 모두 벗긴 뒤 물에 하루 담가두었다 냉동보관,
187,잣,"8월, 9월, 10월, 11월, 12월, 1월",-20℃~0℃,640Kcal,수정과,,"변비 예방, 개선, 피부 미용, 빈혈 예방, 혈관질환 예방",크기가 고르고 깨진 것이 많고 표면에 상처가 많은 것이 국산이다.,껍질을 까서 사용한다.,죽을 끓일 때나 고명으로 이용한다.,그늘지고 서늘한 곳에 껍질째 보관하거나 냉동보관,
188,은행,"9월, 10월",18~22℃,187Kcal,밥,,"식욕증진, 기침 완화, 야뇨증 치료, 고혈압 예방",알이 고르고 깨끗하며 잘 마른 것,물에 씻은 후 껍질을 벗긴다.,볶아서 먹거나 밥에 넣어 먹는다.,껍질 있는 것은 종이봉투에 넣어 냉장 보관,
189,호박씨,"3월, 4월, 5월, 6월, 7월, 8월, 9월, 10월",18~22℃,558Kcal,우유,,"불면증 개선, 피부 미용, 두뇌 발달, 비염 완화",흰색이며 모양이 일정하고 통통한 것,물에 씻은 후 말려서 껍질을 벗긴다.,"생으로 먹거나 고명, 베이킹 등에 이용한다.",그늘지고 서늘한 곳에 껍질째 보관하거나 냉동보관,
190,헤이즐넛,연중,-20~0℃,371Kcal,초콜릿,,"노폐물 배출, 다이어트, 변비, 두뇌발달",,밀봉해 냉장보관한다.,제과제빵 등에 활용한다.,밀봉하여 보관한다.,
191,캐슈넛,연중,-20~0℃,565Kcal,닭고기,,"성인병, 두뇌활동, 변비, 노화방지, 지혈","이물질이 없이 깨끗하며 냄새가 없고, 맛이 부드러운 것이 좋다.",흐르는 물에 깨끗이 씻어 물기를 제거한다.,"제과제빵, 샐러드에 활용한다.",밀봉하여 실온에 보관한다.,
192,아몬드,연중,-20~0℃,598Kcal,초콜릿,,"노화 예방, 변비, 피로회복, 콜레스테롤",너무 마르지 않고 붉은 갈색을 띄는 것이 좋다.,주로 포장제품을 구입하므로 유통기한과 포장의 진공상태를 확인한다.,"조리 전 마른행주로 이물질을 닦아내고, 기름을 두맂 않고 볶아내면 고소한 맛이 증가한다.",다른 음식의 냄새를 잘 흡수하기 때문에 반드시 밀봉하여 공기를 차단한 상태로 보관한다.,
193,호두,연중,-20~0℃,652Kcal,우유,,"동맥경화, 심신안정, 피부미용, 변비, 당뇨",들었을 때 묵직하고 껍질을 까지 않은 것이 좋다. 껍질에 구멍이 있는 것은 벌레 먹은 것이니 피하도록 한다.,망치로 두드려 단단한 껍질을 깨고 알맹이를 골라낸다.,멸치와 함께 볶아 반찬으로 먹거나 제과재빵에 활용한다.,산화방지를 위해 껍질을 벗기지 않고 밀폐용기에 담아 냉동 보관한다.,
194,피스타치오,9~10월,-20~0℃,586Kcal,초콜릿,,"콜레스테롤, 눈건강, 골다공증, 변비, 노화방지",선명한 녹색을 띄는 것이 좋다.,벌어진 껍질을 양쪽으로 잡아당겨 껍질을 깐다.,"생으로 먹거나 제과제빵, 아이스크림에 활용한다.",견과류는 산패하기 쉬우므로 밀봉해 냉동 보관한다.,
195,피칸,연중,-20~1℃,691Kcal,시리얼,,"동맥경화, 두뇌발달, 노화방지, 항암효과",상처가 없고 통통한 것이 좋다.,망치로 두드려 단단한 껍질을 깨고 알맹이를 골라낸다.,"생으로 먹거나 제과제빵, 아이스크림에 활용한다.",견과류는 산패하기 쉬우므로 밀봉해 냉동 보관한다.,
196,해바라기씨,9~10월,-20~2℃,619Kcal,육류,,"심신안정, 동맥경화, 고혈압, 빈혈, 냉증",통통하며 선명한 노란색을 띄는것이 좋다.,젖은 가제 수건에 해바라기씨를 넣고 눌러서 살짝 비벼주면 쉽게 껍질을 벗겨낼 수 있다.,멸치와 함께 볶아 반찬으로 먹거나 제과재빵에 활용한다.,견과류는 산패하기 쉬우므로 밀봉해 냉동 보관한다.,
197,버터,연중,-20℃~0℃,405Kcal,빵,,"혈액 순환, 변비 예방","냉장 유통된 것, 포장이 깨끗한 것",,"빵에 발라먹거나 베이킹, 요리 등에 이용한다.",밀봉하여 냉동보관,
199,땅콩버터 ,연중,1~5℃,642Kcal,식빵,,"두뇌 발달, 심장병 예방, 변비 예방, 노화 방지",밀봉이 잘 되어있고 유통기한이 충분한 것.,바로 사용가능하다.,빵에 발라 먹거나 베이킹에 이용한다.,밀봉하여 냉장보관,
200,치즈,연중,1~5℃,325Kcal,빵,,"골다공증 예방, 숙취 해소, 항암 작용, 충치 예방",용도에 맞는 적절한 종류의 치즈를 구입한다.,,그대로 먹거나 샌드위치 등 요리에 이용한다.,밀봉하여 냉장보관 혹은 냉동보관,
201,스트링치즈,연중,1~5℃,288Kcal,양상추,,"골다공증 예방, 숙취 해소, 항암 작용, 충치 예방",밀봉이 잘 되어있고 유통기한이 충분한 것.,먹기 좋은 크기로 잘라 이용한다.,"그대로 먹거나 피자, 스파게티, 볶음밥 등 요리에 이용한다.",밀봉하여 냉장보관,
202,체다치즈,연중,1~5℃,236Kcal,파슬리,,"골다공증 예방, 숙취 해소, 항암 작용, 충치 예방",밀봉이 잘 되어있고 유통기한이 충분한 것.,겉을 마른 면보로 닦고 슬라이스한다.,그대로 먹거나 샌드위치 등 요리에 이용한다.,밀봉하여 냉장보관 혹은 냉동보관,
203,연유,연중,1~5℃,340Kcal,샐러드,,뼈 건강,밀봉이 잘 되어있고 유통기한이 충분한 것.,,소스로 이용하거나 베이킹에 이용한다.,실온보관하다 개봉 후에는 냉장보관,
204,파마산치즈,연중,1~5℃,432Kcal,빵,,"골다공증 예방, 숙취 해소, 항암 작용, 충치 예방",밀봉이 잘 되어있고 유통기한이 충분한 것.,그라인더로 치즈를 갈아서 사용한다.,파스타나 피자 등에 뿌려 먹거나 요리에 이용한다.,밀봉하여 냉장보관 혹은 냉동보관,
207,크림치즈,연중,1~5℃,295Kcal,식빵,,"골다공증 예방, 숙취 해소, 항암 작용, 충치 예방",밀봉이 잘 되어있고 유통기한이 충분한 것.,바로 사용가능하다.,빵에 발라먹거나 베이킹 등에 이용한다.,밀봉하여 냉장보관 혹은 냉동보관,
208,요거트,연중,,65Kcal,,,장 건강,밀봉이 잘 되어있는 것을 고르고 유통기한을 확인한다,구입하거나 만들어 사용할 수 있다.,그냥 먹거나 시리얼이나 과일과 함께 먹거나 카레 등의 요리에 이용한다.,밀봉하여 냉장보관,
210,마가린,연중,0~5℃,721Kcal,식빵,,,시중에서 구입 시 유통기한을 확인한다.,다른 음식의 냄새를 잘 흡수하기 때문에 반드시 밀봉하여 공기를 차단한 상태로 냉장 보관한다.,"제과제빵, 수프, 소스 등 버터가 쓰이는 요리에 사용한다.",다른 음식의 냄새를 잘 흡수하기 때문에 반드시 밀봉하여 공기를 차단한 상태로 냉장 보관한다.,
211,모짜렐라치즈,연중,1~5℃,277Kcal,발사믹식초,,다이어트,"비숙성 치즈라 치즈 냄새가 없고, 아이보리색을 띠며 곰팡이가 피지 않는 것이 좋다. 구입 시 유통기한을 꼭 확인한다.",프레시 모차렐라치즈는 요리에 이용시 수분을 잘 제거하여 사용한다.,토마토와 발사믹식초를 곁들여 샐러드로 먹으면 맛이 좋다.,"가급적 바로 사용하고, 남은 것은 쉽게 상할 수 있으니 소량씩 구입하고 밀봉하여 냉동 보관한다.",
213,슬라이스치즈,연중,1~5℃,305Kcal,식빵,,"골다공증, 노화방지, 다이어트",시중에서 구입 시 유통기한을 반드시 확인한다.,먹기 편하게 포장되어있으므로 특별한 손질없이 바로 섭취 가능하다.,"햄버거, 샌드위치, 카나페 등 활용한다. 볶음밥에 함께 넣어 먹으면 고소한 맛이 진해지고 떡볶이에 넣어먹어도 매운맛이 중화되어 좋다.",반드시 랩에 싸서 냉장 보관한다. 치즈는 쉽게 상할 수 있으니 소량씩 구입하고 남은 것은 밀봉하여 냉동 보관한다.,
215,피자치즈,연중,1~5℃,223Kcal,토마토,콩,골다공증,시중에서 구입 시 유통기한을 반드시 확인한다.,특별한 손질 없이 음식에 넣어 조리한다.,"피자, 그라탕, 볶음밥, 토스트 등 다양한 곳에 활용한다.",반드시 랩에 싸서 냉장 보관한다. 치즈는 쉽게 상할 수 있으니 소량씩 구입하고 남은 것은 밀봉하여 냉동 보관한다.,
217,휘핑크림,연중,0~5℃,399Kcal,빵,,,시중에서 구입 시 유통기한을 반드시 확인하고 냉장 보관이 잘 된 것을 구매한다.,특별한 손질없이 바로 섭취 가능하다. 생크림에 유화제나 식물성 안정제등을 넣어서 생크림보다 단단하고 윤기있게 휩을 만들 수 있다.,"생크림과 같이 파스타 소스를 만들때 사용하기도 하고, 휘핑기로 단단하게 만들어 빵과 함께 곁들여 먹기도 한다.",밀봉하여 냉장 보관한다.,
218,우유,연중,1~5℃,61Kcal,호두,초콜릿,"골다공증, 성장발육, 두뇌발달, 불면증",시중에서 구입 시 유통기한을 반드시 확인하고 냉장 보관이 잘 된 것을 구매한다.,"우유는 구입 후 즉시 섭취가능하고, 젖소에서 짜낸 직후에는 소독을 거친 후 섭취해야한다.","간식으로 먹거나 육류, 생선요리의 비린내를 제거하는 데 좋다. 소스나 제과제빵에 활용하기도 한다.",우유는 개봉 후 가급적 빨리 섭취하며 꼭 냉장 보관한다. 우유는 냄새를 흡수하는 성질이 있어서 냄새를 유발하는 식품과는 가급적 같이 보관하지 않는다.,
219,달걀,연중,1~5℃,139Kcal,감자,,"시력 보호, 두뇌 개발, 숙취 해소, 성인병 예방","표면이 거칠하고 무거운 것, 불빛에 비춰서 투명한 것.",흐르는 물에 씻는다.,"날것으로 먹거나 굽기, 찌기, 삶기 등 다양한 조리가 가능하다.",뾰족한 곳이 아래로 가도록 하여 냉장 보관,
221,메추리알,연중,1~5℃,170Kcal,꽈리고추,,"면역력 증진, 원기회복, 성인병 예방, 성장 발육",표면이 거칠하고 크기에 비해 무게가 있는 것.,냄비에 소금을 약간 넣고 삶는다.,삶아서 조림에 사용한다.,냉장보관,
224,고춧가루,연중제철,0~5℃,324Kcal,더덕,,"식욕촉진, 단백질소화, 감기예방, 면역력증진",국산이 제일 좋다. 선홍색을 띠고 부드럽과 맛과 냄새가 강하지 않은 것으로 고른다.,바로 사용가능하다.,"양념장 등 한식에는 두루두루 사용할 수 있으며, 매운 맛이 필요한 곳에 첨가하여 사용한다.",냉장/냉동 보관한다,
225,후춧가루,,18~22℃,347Kcal,육류,,"소화촉진, 식욕부진 개선, 발한 촉진, 향균, 진정",유통기한을 확인한다.,바로 사용가능하다.,향과 특유의 매운맛이 강하여 냄새제거 및 육류 요리에 사용한다.,직사광선을 피하여 건조하고 서늘한 곳에 보관한다.,
226,설탕,연중제철,0~5℃,387Kcal,팥,,에너지원,"덩어리지지 않은 것을 고르며, 유통기한을 확인하여야 한다.",바로 사용가능하다.,단 맛이 필요할 때 첨가한다.,직사광선을 피하여 그늘진 곳에 보관한다.,
227,꿀,3~10월,18~25℃,294Kcal,홍차,,피로회복,색깔은 노르스름하며 분리 되지 않고 겨울에도 얼지 않는 것이 좋다.,바로 사용가능하다.,"설탕대신 단 맛을 내는 데 사용하고, 감기나 피로할 때 차로 마시기도 한다.",밀폐하여 그늘 진 곳에 보관한다.,
228,마요네즈,연중제철,10~15℃,707Kcal,,,,층이 분리되어 있으면 구입하지 않고 유통기한을 확인한다.,사용할 만큼 덜어 바로 사용한다.,"소스나 샐러드, 덮밥 등 다양하게 사용할 수 있다.",직사광선이 닿지 않는 서늘한 곳에서 보관한다. 냉장보관시 온도가 낮으면 층분리가 일어나기 때문에 냉장고 문쪽에 보관하는 것이 좋다.,
231,식초,연중제철,10~15℃,30Kcal,등푸른 생선,,"식욕촉진, 다이어트, 피로회복","유통기한을 확인하고, 통이 찌그러지거나 부풀러 올라왔는지 확인해야 한다. 침전물이 있는지도 확인 해야한다 .",바로 사용가능하다.,신 맛이 필요한 부분에 첨가하여 사용한다.,밀폐하여 그늘 진 곳에 보관한다.,
232,토르티야,연중제철,-20~0℃,287Kcal,,,,유통기한을 확인하고 구매한다.,"포장상품은 후라이팬에 바로 구워 사용하고, 밀가루, 소금, 버터, 우유를 넣어 만들어 사용할 수 있다.",후라이팬에 구워 각 종 속재료를 채워 돌돌 말아 섭취하는 것이 일반적이다.,냉동보관한다.,
233,다진마늘,"3월, 4월, 5월",10~15℃,120Kcal,돼지고기,,"소화촉진, 피로회복, 혈액순환, 항암효과, 면역력",알이 굵고 단단한 것,물에 10분 정도 불려 놓으면 쉽게 껍질을 벗길 수 있다,"생으로 먹기도 하며, 구워 먹기도 한다, 각종 양념에 사용된다","껍질을 제거하기 전 마늘은 망에 넣어 서늘한 곳에 보관하고, 깐마늘은 다져서 조금씩 분리해 냉동실에 보관한다",
234,밀가루,연중제철,10~15℃,370Kcal,표고버섯,,"변비예방, 대장암예방",입자가 곱고 덩어리 진 것이 없으며 백색에서 아이보리색이 좋다.,체에 쳐서 사용하거나 그냥 사용해도 무방하다.,"글루텐 함량에 따라 용도가 달라지지만, 전반적으로 제과제빵, 제면 등에 많이 사용 된다.",밀봉하여 직사광선이 닿지 않는 건냉한 곳에 보관한다.,
237,고추기름,연중제철,18~22℃,,,,"감기예방, 면역력증가, 항균",유통기한을 확인하고 매콤한 향이 나는 것이 좋다.,고춧가루를 식용유에 볶아 만든 기름이다. 바로 사용가능하다.,"육개장, 닭개장, 순두부지개, 해물요리 등 다양하게 사용 가능하다.",직사광선은 피하고 밀봉하여 서늘한 곳에서 보관한다.,
238,라이스페이퍼,연중제철,10~15℃,347Kcal,채소,,,유통기한을 확인하고 구매한다.,사용하기 전에 물에 적셔 사용한다.,라이스페이퍼에 쌈을 싸서 먹거나 춘권처럼 안에 속재료를 넣고 튀겨 사용한다.,직사광선을 피해 실온 보관한다.,
239,라임즙,연중제철,0~5℃,25Kcal,,,"감기예방, 식욕증진",유통기한을 확인하고 구입한다.,바로 사용가능하다.,"비린내를 제거할 때 사용하거나 디저트, 드레싱, 소스 등 상큼한 맛이 필요할 때 사용한다.",밀봉하여 냉장보관한다.,
243,랍스타,5~8월,-20~0℃,126Kcal,버터,,"성장촉진, 콜레스테롤저하","부패한 냄새가 나지 않으며, 만졌을 때 탄력이 있고 무거운 것이 좋다.","머리와 몸통을 잡고 비틀어 머리를 분리 한 다음, 꼬리를 자르고, 꼬리 부분에 손을 넣어 몸통 살을 분리한다. 분리 된 살의 등쪽을 갈라 내장을 제거하면 살만 사용 가능하다.","분리하여 사용하면 단맛이 다 빠져나가기에, 보통 통으로 쪄서 사용한다. 살만 발라내어 요리를 해도 되고, 통으로 조리하여도 좋다. 살 외의 부분은 육수로 사용된다.","토막내지 않고 통으로 밀폐하여 보관하며, 냉동 보관한다.",
244,래디시,6월,10~15℃,,,,"노화방지, 피부미용","알이 단단하고 광이 나며, 색이 선명하고 속살은 하얀 것이 좋다.",흐르는 물에 씻어 사용한다.,"샐러드나 피클, 김치등으로 사용 할 수 있다.",밀봉하여 냉장고나 서늘한 곳에 보관한다.,
246,레드와인,연중제철,10~15℃,85Kcal,육류,,"심장마비예방, 협심증예방, 뇌졸증예방",색이 깨끗하고 맑으며 빛이 나는 것이 좋다. 갈색을 띠거나 혼탁한 것은 변질 된 것이니 구매하지 않는 것이 좋다.,바로 사용 가능하다.,"실온에서 바로 마시거나 스튜냐 조림, 구이 등에 첨가하여 활용할 수 있다.",개봉을 하지 않았다면 영구적으로 보관가능하나 개봉을 하였다면 마개를 끼워 서늘한 곳에 보관하고 최대한 빨리 사용한다.,
247,레드페퍼,,,57Kcal,,,"감기예방, 통증 완화, 항균, 항암효과","단단하며 벌레 먹지 않은 것이 좋으며, 광이 나고 색이 선명한 것이좋다.","고추의 꼭지를 따고 배를 갈라 씨를 빼낸 후 닦고 건조시킨 후 가루를 낸다. 가루는 곱게, 중간, 굵게 낼 수 있다.","고운가루는 고추장으로, 중간 가루는 김치, 굵은 가루는 풋김치 열무김치 등에 쓴다.",공기가 통하면 성분이 날아감으로 밀봉하여 서늘한데 보관한다.,
250,레몬즙,연중제철,0~5℃,22Kcal,,,"감기예방, 피로회복, 변비해소",유통기한을 확인하고 사용한다.,"가공된 것을 구입하거나, 생 레몬을 반으로 갈라 레몬즙짜개로 짜 씨를 빼고 사용한다.","드레싱이나 소스, 디저트, 구이 등 다양하게 사용할 수 있다.",냉장보관한다.,
252,로메인,,0~5℃,29Kcal,돼지고기,,"피부미용, 해독작용, 변비해소, 다이어트, 구취제거, 수면유도, 붓기제거",잎에 광이 나고 잎줄기가 두꺼우며 흐물거리지 않는 것이 좋다.,흐르는 물에 씻어 사용한다.,"주로 쌈채소로 사용하고, 샐러드나 겉절이, 비빔밥, 샌드위치 등에 활용한다.",밀봉하여 냉장고나 서늘한 곳에 보관한다.,
253,로즈마리,연중제철,18~22℃,331Kcal,"육류,삼치",,"발한촉진, 노화방지","신선한 생로즈마리는 잎에서 광택이 나고 잎의 색이 짙으며, 뒷면은 솜털이 나있고 흰색을 띤다. 건로즈마리는 유통기한을 확인한다.",흐르는 물에 세척 한 후 사용한다.,주로 육류요리에 사용되며 향이 강해 냄새가 심한 양고기나 돼지고기에 사용한다.,직사광선은 피하고 통풍이 잘 되는 곳에 냉동 보관 한다.,
259,건새우,연중제철,10~15℃,233Kcal,,,골다공증예방,형태가 완정하고 색이 붉고 투명한 것이 좋다.,바로 사용가능하다.,볶아 먹거나 국물을 우려낼 때 사용한다.,밀봉하여 직사광선이 닿지 않고 건조하고 서늘한 곳에 보관한다.,
262,건고추,연중제철,0~5℃,300Kcal,,,,벌레먹지 않고 광택이 나며 바싹 마른 것이 좋다.,가루를 내어 사용하거나 조리시 잘라 사용하거나 통으로 사용한다.,"수분이 필요 없으며, 매운맛이 필요할 때 첨가하여 사용한다. 볶거나, 조림으로 많이 사용한다.",밀봉하여 서늘하고 건조한 것에 보관하거나 냉장/냉동보관한다.,
263,건오징어,연중제철,-20~0℃,352Kcal,땅콩,,"피로회복, 스트레스완화",냄새가 나지 않고 두께가 적당한 것이 좋다.,찢거나 잘라 사용가능하다.,구워서 소스에 찍어 먹는다.,밀봉하여 냉동보관한다.,
265,건홍합,연중제철,-20~0℃,391Kcal,,,"피로회복, 스테미너, 빈혈예방, 동맥경화예방, 고지혈증예방",살이 통통하고 살이 붉은기가 도는 것이 좋다.,끓는 물에 끓여 사용한다.,"국, 탕 등에 사용하거나 무침, 조림 등에 사용한다.",냉동보관한다.,
266,스테이크소스,연중제철,0~5℃,96Kcal,스테이크요리,,,유통기한을 확인하고 구입한다.,바로 사용한다.,"새로운 소스를 만드는데 첨가하거나, 바로 사용할 수도 있으며, 양념을 만들고, 조림, 볶음 등에 사용할 수 있다.",직사광선을 피해 그늘지고 서늘한 곳에 보관한다.,
267,가쓰오부시,연중제철,10~15℃,323Kcal,된장,,"간보호, 성인병예방, 콜레스테롤저하","갈아져 있는 것을 구매 할 땐, 살이 연하고 연한 갈색을 띠는 것이 좋다.",바로 사용가능하다,주로 끓는 물에 넣어 육수를 내거나 요리가 끝난 후 고명용으로 뿌린다.,밀봉하여 서늘하고 건조한 곳에 보관한다.,
271,건고사리,연중제철,,228Kcal,,,"변비, 시력보호, 면역력","짙은 밤색을 띠고, 대가 통통한 것이 좋다",물에 불려 먹거나 데쳐서 사용한다.,"주로 나물 무침으로 먹거나, 국, 탕, 조림, 볶음 등에 사용한다.",끓는 물에 소금을 넣고 삶아내고 냉동실에 보관한다,
273,건크랜베리,연중제철,10~15℃,308Kcal,,,"여성질환, 방광염치료, 항암효과, 노화방지, 시력개선",유통기한과 곰팡이가 없는지 확인하고 구입한다.,"바로 섭취, 사용가능하다.","빵이나 디저트에 첨가해 새콤달콤한 맛을 내거나 샐러드, 에너지바에도 첨가하여 사용한다.",밀페용기에 담아 직사광선을 피해 냉장보관한다.,
